mysql> desc student;
+------------+--------------+------+-----+---------+----------------+
| Field      | Type         | Null | Key | Default | Extra          |
+------------+--------------+------+-----+---------+----------------+
| student_id | int(11)      | NO   | PRI | NULL    | auto_increment |
| name       | varchar(200) | YES  |     | NULL    |                |
| major      | varchar(200) | YES  |     | NULL    |                |
+------------+--------------+------+-----+---------+----------------+
3 rows in set (0.09 sec)

mysql> insert into student(name,major)values('johnny','Bootsrap');
Query OK, 1 row affected (0.16 sec)

mysql> insert into student(name,major)values('kranthi','English');
Query OK, 1 row affected (0.06 sec)

mysql> insert into student(name,major)values('chandra','Maths');
Query OK, 1 row affected (0.08 sec)

mysql> insert into student(name,major)values('jerry','botany');
Query OK, 1 row affected (0.09 sec)

mysql> insert into student(name,major)values('Max','General science');
Query OK, 1 row affected (0.07 sec)
mysql> update student SET major='Bio' WHERE major='English';
Query OK, 2 rows affected (0.21 sec)
Rows matched: 2  Changed: 2  Warnings: 0

mysql> select * from student;
+------------+--------+------------------+
| student_id | name   | major            |
+------------+--------+------------------+
|          1 | johnny   | Bootsrap      |
|          2 | kranthi  | English      |
|          3 | chandra  | Maths         |
|          4 | jerry    | botany        |
|          5 | Max      | General science |
+------------+--------+------------------+
5 rows in set (0.00 sec)

mysql> select student.name,
student.major from 
student ORDER BY name;
+--------+------------------+
| name   | major            |
+--------+------------------+
| chandra | chemistry        |
| jerry   | botany           |
| jerry   | botany           |
| kranthi | English          |
| Max     | General science  |
5 rows in set (0.37 sec)

mysql> select student.name,
student.major from
student ORDER BY name desc;
+--------+------------------+
| name   | major            |
+--------+------------------+
| Max    | General science |
| kranthi| English         |
| jerry  | botany          |
| jerry  | botany          |
| charle | chemistry       |
+--------+------------------+
5 rows in set (0.00 sec)

mysql> select * from student
ORDER BY student_id ASC;
+------------+--------+------------------+
| student_id | name   | major            |
+------------+--------+------------------+
|          1 | jerry   | botany         |
|          2 | kranthi | English        |
|          3 | chandra | chemistry      |
|          4 | jerry   | botany         |
|          5 | MAx     | General science|
+------------+--------+------------------+
5 rows in set (0.04 sec)

mysql> select * from student
ORDER BY student_id desc;
+------------+--------+------------------+
| student_id | name   | major            |
+------------+--------+------------------+
|          5 | Max     | General science |
|          4 | jerry   | botany          |
|          3 | chandra | chemistry       |
|          2 | kranthi | English         |
|          1 | jerry   | botany          |
+------------+--------+------------------+
5 rows in set (0.00 sec)

mysql> select * from student LIMIT 2;
+------------+------+-----------+
| student_id | name | major     |
+------------+------+-----------+
|          1 | jerry   | botany  |
|          2 | kranthi | English |
+------------+------+-----------+
2 rows in set (0.07 sec)

mysql> select * from student
ORDER BY 
student_id DESC LIMIT 2;
+------------+------+------------------+
| student_id | name | major            |
+------------+------+------------------+
|          5 | Max  | General science  |
|          4 | jerry| botany           |
+------------+------+------------------+
2 rows in set (0.00 sec)

mysql> select * from student 
WHERE
major IN('botany','Chemistry');
+------------+--------+-----------+
| student_id | name   | major     |
+------------+--------+-----------+
|          3 | charle | chemistry |
+------------+--------+-----------+
1 row in set (0.13 sec)

mysql> select * from student 
WHERE major IN('Biology','Chemistry') 
AND student_id>2;
+------------+--------+-----------+
| student_id | name   | major     |
+------------+--------+-----------+
|          3 | chandra | chemistry |
+------------+--------+-----------+
1 row in set (0.44 sec)

mysql> select DISTINCT name from student;
+--------+
| name   |
+--------+
| jerry   |
| kranthi |
| chandra |
| Max     |
+--------+
4 rows in set (0.08 sec)

